<?xml version="1.0" encoding="UTF-8" ?>
<!DOCTYPE database SYSTEM "./nazev.dtd">
<database>
	<!-- Seznam vsech pojistovacich agentu, vyuzivacich teto program -->	
	<agents>
		<agent id="a0">
			<name>Petr Babicka</name>
			<email>babcca@gmail.com</email>
			<password>asd8s890adas89s0asd890ada678</password>
			<identification>1231321331</identification>
			<registration>2143241241</registration>
			<address>
				<street>V hlusinach 12</street>
				<city>Svetla nad Sazavou</city>
				<postal>58291</postal>
			</address>
			<settings>
				<printers>
					<print name="hp2110" offset_x="5" offset_y="10" />
					<print name="ineo210" offset_x="0" offset_y="0" />
				</printers>
			</settings>
		</agent>
	</agents>
	<clients>
		<client id="c0">
			<name>Karel Omacka</name>
			<subject type="fyzicka" dph="false">
				<subject_id type="date">12.12.1989</subject_id>
			</subject>
			<address>
				<street>V hlusinach 12</street>
				<city>Svetla nad Sazavou</city>
				<postal>58291</postal>
			</address>
		</client>
	</clients>
		
		
		
		
		
</database>